{
  "schemaVersion": 1,
  "kind": "optional",
  "engines": {
    "sesame": ">=0.2.0-0"
  },
  "packages": [
    "sesame/abu-backtest-lab",
    "sesame/abu-breakout",
    "sesame/abu-exit-rules",
    "sesame/abu-indicators",
    "sesame/abu-ml-features",
    "sesame/abu-model-lab",
    "sesame/abu-moving-average",
    "sesame/abu-parameter-search",
    "sesame/abu-position-sizing",
    "sesame/abu-price-structure",
    "sesame/abu-seasonality",
    "sesame/abu-similarity",
    "sesame/abu-stock-screening",
    "sesame/abu-trade-judges",
    "sesame/abu-trade-metrics",
    "sesame/abu-trend",
    "sesame/abu-trend-pullback",
    "sesame/abu-volatility",
    "sesame/akshare",
    "sesame/auto-factor-mining",
    "sesame/backtrader",
    "sesame/behavioral-finance",
    "sesame/binance",
    "sesame/ccxt",
    "sesame/dow-theory",
    "sesame/elliott-wave",
    "sesame/factor-evaluator",
    "sesame/factor-research",
    "sesame/financial-research",
    "sesame/ict",
    "sesame/institutional-analysis",
    "sesame/investment-research",
    "sesame/judgment-evolution",
    "sesame/kurumi-replay",
    "sesame/market-data-parser",
    "sesame/mt5",
    "sesame/narrative-analysis",
    "sesame/portfolio-execution",
    "sesame/price-action",
    "sesame/qmt",
    "sesame/quantskills-catalog",
    "sesame/rss-collect",
    "sesame/strategy-research",
    "sesame/trading-decision",
    "sesame/vnpy",
    "sesame/web-extract",
    "sesame/web-sources",
    "sesame/wyckoff"
  ]
}
